{
  "$schema": "https://json-schema.org/draft/2020-12/schema",
  "$id": "cartas-mesa.schema.json",
  "title": "Mesa del Duelo de Cartas (mundo/datos/cartas-mesa.json)",
  "description": "Medidas de la mesa 3D junto a Lucho y de sus cámaras (metros y grados; local de la mesa: x a tu derecha, z hacia ti, y hacia arriba). Lo que falte usa MESA de mundo/supervivencia/cartas-mesa-modelo.js. Los arreglos (terceras, mira) reemplazan enteros.",
  "type": "object",
  "properties": {
    "$schema": { "type": "string" },
    "version": { "$ref": "comun.schema.json#/$defs/version" },
    "nota": { "$ref": "comun.schema.json#/$defs/nota" },
    "mesa": { "$ref": "#/$defs/numeros" },
    "carta": { "$ref": "#/$defs/numeros" },
    "zonas": { "$ref": "#/$defs/numeros" },
    "manoRival": { "$ref": "#/$defs/numeros" },
    "mazo": { "$ref": "#/$defs/numeros" },
    "desc": { "$ref": "#/$defs/numeros" },
    "asiento": { "$ref": "#/$defs/numeros" },
    "camara1": { "$ref": "#/$defs/camara" },
    "enfoque": { "$ref": "#/$defs/camara" },
    "terceras": { "type": "array", "minItems": 1, "maxItems": 8, "items": { "$ref": "#/$defs/camara" } },
    "mini": { "$ref": "#/$defs/numeros" },
    "mano": { "$ref": "#/$defs/numeros" },
    "anim": { "$ref": "#/$defs/numeros", "description": "Animaciones: activas (0/1), velocidad, arco, alzar, embestida, sacudida, flota (px), numero (px), pulso, tocarSalta (0/1). Ver ANIM en mundo/supervivencia/cartas-anim-modelo.js" },
    "duraciones": { "$ref": "#/$defs/numeros", "description": "Segundos que dura la animación de cada evento de aplicar (roba, invoca, ataque, muere…)" },
    "sigue": { "$ref": "#/$defs/numeros", "description": "Cuánto de cada evento (0-1) pasa antes de que empiece el siguiente" },
    "colores": { "$ref": "#/$defs/colores" },
    "sonido": { "$ref": "#/$defs/numeros", "description": "Sonido del duelo (sintetizado): activo (0/1), volumen general y volumen de cada sonido: roba, juega, ataque, golpe, destruye, hechizo, efecto, cura, turno, gana, pierde, empate (0 lo apaga)" },
    "turnoLucho": { "$ref": "#/$defs/numeros", "description": "Turno de Lucho: enPartida (1 = la cámara lo mira también fuera del tutorial), pausa (s mirándolo antes de su primera jugada), mesa (s que la cámara se queda en la mesa tras su jugada)" },
    "planoLucho": { "$ref": "#/$defs/camara", "description": "Cámara que mira a Lucho en su turno: lado, alto (sobre la mesa), z (hacia ti) y mira" },
    "planoMesa": { "$ref": "#/$defs/camara", "description": "Cámara sobre la mesa cuando Lucho juega una carta: lado, alto (sobre la mesa), z (hacia ti) y mira" },
    "coleccion": { "$ref": "#/$defs/numeros", "description": "Duelo: colección y mazo (cartas-coleccion.js). largo (cartas del mazo, 10-40), copias (máximo por carta, 1-4), azarExtra (cartas de más en la mano con el mazo al azar, 0-3), azarTodas (1 = el mazo al azar sale de todas las cartas, 0 = de tu colección), hechizosMin y hechizosMax (hechizos de un mazo al azar). Ver COLECCION" },
    "duelo": { "$ref": "#/$defs/numeros", "description": "Duelo entre 2 jugadores de la sala (cartas-duelo.js, actividad duelo@lucho de actividades-red.js): vida (de cada uno), mano (cartas al empezar; el mazo al azar suma azarExtra), espera (segundos para aceptar el reto; 0 = sin límite). Ver DUELO" },
    "coleccionInicial": { "$ref": "#/$defs/numeros", "description": "Copias de cada carta (por clave de CARTAS) con que parte un jugador que nunca tocó su colección; 0 = no la tiene. Ver COLECCION_INICIAL en cartas-coleccion.js" },
    "tiendaCartas": { "$ref": "#/$defs/numeros", "description": "Tienda de cartas del Duelo (cartas-tienda.js; la vende el amigo con cartas: true en tienda-datos.js). activa (0/1), sobrePrecio (esmeraldas, 1-64), sobreCartas (1-10), sobreNuevas (cuántas salen de las que no tienes), sobreHechizos (mínimo por sobre), sueltaTope (1 = no vende una suelta si ya tienes las que caben en un mazo). Ver TIENDA_CARTAS" },
    "preciosCartas": { "$ref": "#/$defs/numeros", "description": "Esmeraldas por cada carta suelta (por clave de CARTAS), antes del descuento de amistad; 0 = no se vende suelta. Sin la clave: precioBase de cartas-tienda.js" },
    "sobreAnim": {
      "type": "object",
      "description": "Abrir un sobre comprado (cartas-sobre.js): activa (0/1), rasgar (fracción del ancho a arrastrar), toques, salir / voltear / entre / tapa (segundos), ancho (px), sacudir (0/1), sonido (volumen), color / franja / letra (colores del sobre). Ver SOBRE_ANIM",
      "properties": {
        "nota": { "$ref": "comun.schema.json#/$defs/nota" },
        "color": { "type": "string", "pattern": "^#[0-9a-fA-F]{6}$" },
        "franja": { "type": "string", "pattern": "^#[0-9a-fA-F]{6}$" },
        "letra": { "type": "string", "pattern": "^#[0-9a-fA-F]{6}$" }
      },
      "additionalProperties": { "type": "number" }
    },
    "pesosSobre": { "$ref": "#/$defs/numeros", "description": "Qué tan seguido sale cada carta (por clave de CARTAS) en un sobre: 1 = normal, 2 = el doble, 0 = nunca. Sin la clave: 1" },
    "tutorial": {
      "type": "object",
      "description": "Tutorial del duelo: color, opacidad, pulso (veces por segundo) y borde (× la carta) del marco de lo que toca usar; leer = segundos que Lucho habla antes de jugar",
      "properties": {
        "nota": { "$ref": "comun.schema.json#/$defs/nota" },
        "color": { "type": "string", "pattern": "^#[0-9a-fA-F]{6}$" }
      },
      "additionalProperties": { "type": "number" }
    }
  },
  "required": ["version"],
  "additionalProperties": false,
  "$defs": {
    "numeros": {
      "type": "object",
      "properties": { "nota": { "$ref": "comun.schema.json#/$defs/nota" } },
      "additionalProperties": { "type": "number" }
    },
    "colores": {
      "type": "object",
      "description": "Colores de los brillos de hechizos (por efecto) y de los números (dano, cura, sube, baja, muere…)",
      "properties": { "nota": { "$ref": "comun.schema.json#/$defs/nota" } },
      "additionalProperties": { "type": "string", "pattern": "^#[0-9a-fA-F]{6}$" }
    },
    "camara": {
      "type": "object",
      "properties": {
        "nota": { "$ref": "comun.schema.json#/$defs/nota" },
        "mira": { "type": "array", "prefixItems": [{ "type": "number" }, { "type": "number" }, { "type": "number" }], "minItems": 3, "maxItems": 3 }
      },
      "additionalProperties": { "type": "number" }
    }
  }
}
