{
  "$schema": "../../estudio/esquemas/cartas-mesa.schema.json",
  "version": 1,
  "nota": "Mesa del Duelo de Cartas junto a Lucho. mesa.giro (grados) = hacia dónde mira Lucho; dist y lado la mueven. terceras = cámaras de 3.ª persona (el botón Vista pasa por cada una; se pueden agregar). manoRival = las cartas que sostiene Lucho (z, alto, sep, inclina).",
  "mesa": { "giro": 0, "dist": 0.75, "lado": 0, "ancho": 1.8, "fondo": 1, "alto": 0.8 },
  "carta": { "ancho": 0.24 },
  "zonas": { "sep": 0.42, "propia": 0.22, "rival": -0.22 },
  "manoRival": { "sep": 0.1, "z": -0.6, "alto": 0.38, "inclina": 20 },
  "mazo": { "x": 0.76, "z": 0.26 },
  "asiento": { "dist": 0.45 },
  "camara1": {
    "alto": 1.62,
    "atras": 0,
    "mira": [0, 0.3, -0.45]
  },
  "enfoque": {
    "alto": 1.25,
    "z": 0.32,
    "mira": [0, 0, -0.02]
  },
  "terceras": [
    {
      "alto": 2.5,
      "atras": 2.4,
      "lado": 1.9,
      "mira": [0, 0.3, -0.4]
    },
    {
      "alto": 2.2,
      "atras": 2.2,
      "lado": -2,
      "mira": [0, 0.3, -0.4]
    }
  ],
  "mini": { "ancho": 0.3, "max": 340, "alto": 1.7, "margen": 12 },
  "mano": { "alto": 0.26, "max": 230, "solape": 0.72, "sube": 0.18 },
  "desc": { "x": 0.76, "z": -0.2 },
  "anim": {
    "activas": 1,
    "velocidad": 1,
    "arco": 0.14,
    "alzar": 0.22,
    "embestida": 0.7,
    "sacudida": 0.025,
    "flota": 46,
    "numero": 34,
    "pulso": 1.6,
    "tocarSalta": 1
  },
  "duraciones": {
    "roba": 0.4,
    "quema": 0.5,
    "invoca": 0.55,
    "hechizo": 1.1,
    "efecto": 0.45,
    "ataque": 0.55,
    "dano": 0.8,
    "cura": 0.8,
    "sube": 0.7,
    "muere": 0.7,
    "vuelve": 0.5,
    "modo": 0.3,
    "escudo": 0.45,
    "salva": 0.5,
    "atada": 0.4,
    "abrazo": 0.6,
    "turno": 1.1
  },
  "sigue": {
    "roba": 0.6,
    "quema": 0.6,
    "invoca": 0.85,
    "hechizo": 0.9,
    "efecto": 0.7,
    "ataque": 0.55,
    "dano": 0.25,
    "cura": 0.3,
    "sube": 0.3,
    "muere": 0.75,
    "vuelve": 0.8,
    "modo": 1,
    "escudo": 0.7,
    "salva": 0.8,
    "atada": 0.6,
    "abrazo": 1,
    "turno": 0.15
  },
  "colores": {
    "poder": "#ff8a3d",
    "rayo": "#ffe14d",
    "curar": "#5dff7a",
    "escudo": "#5ab4ff",
    "once": "#c77dff",
    "revivir": "#f2f2f2",
    "abrazo": "#ff8fc8",
    "efecto": "#ffd24a",
    "dano": "#ff5555",
    "cura": "#55ff55",
    "sube": "#55ff55",
    "baja": "#ff8a3d",
    "muere": "#b02020",
    "atada": "#a0a0a0",
    "salva": "#5ab4ff"
  },
  "sonido": {
    "activo": 1,
    "volumen": 1,
    "roba": 1,
    "juega": 1,
    "ataque": 1,
    "golpe": 1,
    "destruye": 1,
    "hechizo": 1,
    "efecto": 1,
    "cura": 1,
    "turno": 1,
    "gana": 1,
    "pierde": 1,
    "empate": 1
  },
  "turnoLucho": { "enPartida": 1, "pausa": 0.9, "mesa": 0.8 },
  "planoLucho": {
    "lado": 0.35,
    "alto": 0.9,
    "z": 0.8,
    "mira": [0, 0.9, -0.75]
  },
  "planoMesa": {
    "lado": 0,
    "alto": 1.15,
    "z": 0.5,
    "mira": [0, 0, -0.12]
  },
  "tutorial": { "color": "#ffe14a", "opacidad": 0.95, "pulso": 1.6, "borde": 1.14, "leer": 4 },
  "coleccion": {
    "nota": "Duelo: tu colección y tu mazo (cartas-coleccion.js). largo = cartas del mazo; copias = máximo de cada carta; azarExtra = cartas de más en la mano con el mazo al azar; azarTodas = 1 si el mazo al azar sale de todas las cartas (0: de tu colección); hechizosMin y hechizosMax = hechizos de un mazo al azar",
    "largo": 25,
    "copias": 2,
    "azarExtra": 1,
    "azarTodas": 1,
    "hechizosMin": 4,
    "hechizosMax": 7
  },
  "coleccionInicial": {
    "nota": "Copias de cada carta con que parte un jugador (0 = no la tiene); vale para quien nunca tocó su colección",
    "zombi": 0,
    "esqueleto": 1,
    "creeper": 1,
    "arana": 0,
    "enderman": 1,
    "bruja": 0,
    "slime": 0,
    "trauco": 1,
    "imbunche": 1,
    "chonchon": 0,
    "caleuche": 1,
    "pincoya": 0,
    "cuero": 1,
    "calchona": 0,
    "basilisco": 1,
    "pony": 1,
    "boris": 1,
    "venjy": 1,
    "lona": 1,
    "salonas": 1,
    "nacho": 1,
    "hadad": 1,
    "moises": 1,
    "andy": 1,
    "lucho": 0,
    "braulio": 0,
    "conejeros": 0,
    "mila": 1,
    "gala": 1,
    "poder": 2,
    "rayo": 1,
    "curar": 1,
    "escudo": 0,
    "revivir": 0,
    "abrazo": 1,
    "once": 1
  },
  "tiendaCartas": {
    "nota": "Tienda de cartas del Duelo (cartas-tienda.js; la vende el amigo con cartas: true, hoy Lucho). activa = 1 si vende; sobrePrecio = esmeraldas por sobre; sobreCartas = cartas por sobre; sobreNuevas = cuántas salen de las que no tienes (si quedan); sobreHechizos = hechizos mínimos por sobre; sueltaTope = 1: no vende una carta suelta si ya tienes las que caben en un mazo",
    "activa": 1,
    "sobrePrecio": 3,
    "sobreCartas": 3,
    "sobreNuevas": 1,
    "sobreHechizos": 0,
    "sueltaTope": 1
  },
  "preciosCartas": {
    "nota": "Esmeraldas por cada carta suelta (antes del descuento de amistad); 0 = no se vende suelta",
    "zombi": 2,
    "esqueleto": 2,
    "creeper": 2,
    "arana": 2,
    "enderman": 3,
    "bruja": 2,
    "slime": 2,
    "trauco": 2,
    "imbunche": 3,
    "chonchon": 2,
    "caleuche": 3,
    "pincoya": 2,
    "cuero": 2,
    "calchona": 2,
    "basilisco": 3,
    "pony": 2,
    "boris": 3,
    "venjy": 2,
    "lona": 2,
    "salonas": 2,
    "nacho": 2,
    "hadad": 2,
    "moises": 3,
    "andy": 2,
    "lucho": 2,
    "braulio": 2,
    "conejeros": 1,
    "mila": 2,
    "gala": 2,
    "poder": 2,
    "rayo": 3,
    "curar": 2,
    "escudo": 2,
    "revivir": 3,
    "abrazo": 2,
    "once": 2
  },
  "pesosSobre": {
    "nota": "Qué tan seguido sale cada carta en un sobre (1 = normal, 2 = el doble, 0 = nunca)",
    "zombi": 1,
    "esqueleto": 1,
    "creeper": 1,
    "arana": 1,
    "enderman": 1,
    "bruja": 1,
    "slime": 1,
    "trauco": 1,
    "imbunche": 1,
    "chonchon": 1,
    "caleuche": 1,
    "pincoya": 1,
    "cuero": 1,
    "calchona": 1,
    "basilisco": 1,
    "pony": 1,
    "boris": 1,
    "venjy": 1,
    "lona": 1,
    "salonas": 1,
    "nacho": 1,
    "hadad": 1,
    "moises": 1,
    "andy": 1,
    "lucho": 1,
    "braulio": 1,
    "conejeros": 1,
    "mila": 1,
    "gala": 1,
    "poder": 1,
    "rayo": 1,
    "curar": 1,
    "escudo": 1,
    "revivir": 1,
    "abrazo": 1,
    "once": 1
  }
}
